Current Position Requirments,Current Position,Alternative 1,Alternative 2
"At least 1 year of work experience; Experience with team working; Ability to work on multiple tasks and to prioritize personal workload; Very good knowledge of PHP, JavaScript, HTML and CSS; Database proficiency of MySQL; Good knowledge of C# and .NET Framework; Good knowledge of OOP principles; Good knowledge of MVC pattern; Good knowledge of English language. Desired Qualifications: Skills in C/C++, HTML5, iOS SDK and Android SDK; Experience in Windows Mobile development; Database proficiency in SQLServer and Oracle.",PHP Developer,Software Developer,Web Developer
"Higher education (preferably in Media/ Graphical design, Internet); Knowledge of the following programs: Adobe Flash, Adobe Photoshop, Adobe Illustrator, Adobe In Design and Corel Draw; Knowledge of HTML, CSS, Javascript, SEO, web-site administration will be a plus; Refined taste and creative thinking; Well organized, with strong sense of responsibility, disciplined and punctual; Hard working, energetic and enthusiastic; Ability to run several tasks simultaneously; Ability to enjoy life (e.g. playing chess, hiking or performing other activities which makes life fun, etc.).",Graphic Designer,Web Developer,Java Developer
"Higher education in engineering or information technology; 2-3 years of work experience as a Software Engineer with .NET technologies; Object-oriented programming, OOD, Design Patterns, SOA;  Full competency and fluency with C# ASP .Net Framework; web Services (WCF, REST/SOAP/XML-RPC);  Full competency and fluency with MS SQL Server 2008, MySQL; experience with IIS web server, preferable IIS 7.0 or higher;  Windows services, Multithreading, Network programming (sockets/protocols) knowledge is preferable;  Very good understanding of ADO.NET Technology and experience with T-SQL, PL/SQL; experience in PHP and Adobe Photoshop is a plus; experience in HTML, JavaScript, CSS; Experience in Financial field is highly preferred; Applications and services design and implementation skills; Database architecture design skills; Open Source systems/packages and application analysis, configuration, compilation, installation, modification and maintenance skills; Ability to organize and manage multiple assignments within critical deadlines; Good knowledge of Armenian, Russian and English (also technical) languages; Good communication skills.",Software Engineer,Software Developer,Web Developer
"At least 4 years of experience in developing applications in C#, ASP .NET and SQL Server; Experience in coding of T-SQL statements, stored procedures, triggers and functions; Understanding of the mobile-responsive application development; Knowledge of jQuery and JavaScript is a big plus; Demonstrated ability to evaluate user needs or specifications and translate them into a logical and practical set of software components; Ability to own your assignments, formulate your own questions and work with team members to get the answers you need in order to complete assignments; Excellent analytical and problem-solving skills.",.NET Developer,Software Developer,Software Engineer
"Strong object-oriented design skills; Strong analysis and problem solving skills; Strong math skills; Experience with a full product development cycle; Ability to anticipate and prevent problems; Ability to meet a schedule; Communications skills, ability to work well individually and as part of a team of programmers; 3-5 years of experience programming in C++; Passion for computer games.",Software Engineer,Software Developer,Software QA Engineer
"University degree; Experience with Objective-C; experience in developing applications for iOS and Xcode; Knowledge of the common design patterns, frameworks and libraries for iOS; Initiative taking person with problem-solving skills; High sense of responsibility.",iOS Developer,Software Developer,Software Engineer
"Advanced knowledge of OOP; Professional work experience in projects as a Java-developer in J2EE (JSP, Servlets, JDBC, EJB, JMS, Struts) for more than a year; Professional work experience in the development of multi-layered client-server applications, client and server Web application components; Professional work experience in Oracle and MS SQL databases; Experience in IBM WebSphere, WebLogic, JBoss, JRun; Ability to develop quality code, apply proper language constructions, and use quality algorithms; Willingness  to increase your competencies and professionalism; Ability to identify problems on the fly, separate joint moments; Basic knowledge of English language. Desired qualifications: Ability to responsibly complete assigned tasks according to deadlines; Highly productive: ability to work under pressure, adapt to dynamic business environment, make decisions and take responsibility; Energetic, capable of being a team leader; Ability to appropriately make decisions on issues of different complexity for areas of responsibility; Ability to express your thoughts clearly.",Java Developer,Software Developer,Web Developer
"At least 4-6 years of extensive development experience, and at least 3 years of experience with the following technologies: pure C# code both on the middle tier and as part of the web UI layer of ASP.NET; IIS 6 and/ or IIS 7; MS SQL Server 2000, 2005 or 2008; Strong knowledge of C#, WCF, MVC, .NET (2.0, 3.0, 3.5, 4.0), SOAP and XML; Understanding of OTA XML Messaging is a plus; Knowledge of Flash development and Action script is preferable; Familiarity with the .NET Framework, specifically the following packages: messaging, threading, generic collections, custom controls and LINQ to SQL classes and also ADO.NET; Experience with technologies such as jQuery, java Script, HTML, CSS, XML, and related tools; Extensive programming experience with standard management and instrumentation API's; Ability to work independently, as well as with other members in the group; Thorough understanding of software development processes and methodologies and knowledge of complete product development life cycle; Strong inter-personnel skills, ability to work both independently and as part of a global team and thrive on technical challenges; Excellent communication and writing skills, and experience in writing product specifications and technical documentation; Good knowledge of the English language; Self-driven, hard-working personality; Good team player.",Software Engineer,Software Developer,Web Developer
Higher Technical education (preferably in IT sphere); Experience in network maintenance and administration; Knowledge of MS Windows OS Family; Intermediate knowledge of English and Russian languages; Communication skills; Team player abilities.,IT Specialist,Database Admin/Dev,Software Developer
"Bachelors degree in a professional field (Engineering or Information Technology preferred) or comparable experience; 3 years of work experience as a database administrator, preferably in the telecom industry with an emphasis on database performance tuning and optimizations; Excellent technical knowledge of telecom business related database requirements; Full mastery of Oracle and MS SQL Server databases; Full mastery of TSQL and PLSQL languages; Good knowledge of IP networking, Windows and UNIX operating systems; Full mastery of SQL languages and optimizations; Good knowledge of Armenian, English and Russian languages; Ability to organize and manage multiple assignments within critical deadlines; Ability to interact in a positive manner with internal and external contacts.",Database Admin/Dev,Software Developer,Software Engineer
"Knowledge of Visual Basic, SQL Server, SQL and MS Access; Good knowledge of PC/ LAN software and hardware; Knowledge of C++ is an advantage; Knowledge of Armenian, Russian and English languages; Knowledge of technical English language.",Programmer,Software Developer,IT Specialist
"BS in Computing Science; At least 2 years of relevant work experience; Experience of testing mobile applications is desired; Knowledge of MS SQL; Knowledge of VS TFS and Test Manager; Experience in working with automated testing tools is desired; Ability to work on multiple tasks and projects simultaneously; Mastery of technical English language; Good communication skills; Good team player, ability to accept criticism; Ability to be flexible and adapt to changing requirements and customer requests.",Software QA Engineer,Software Developer,PHP Developer
Bachelor's or higher degree in Computer Sciences or a related discipline; At least 2 years of work experience in .Net Framework (C#); Work experience in ASP.NET (JavaScript and Ajax); Professional skills in OOP/ OOD and knowledge of Design Patterns; Work experience in SQL database design and programming; Work experience in development of multi-layered client-server applications and Web Services (WCF) is an advantage; Punctuality and accuracy in work; ability to work efficiently as a part of team; Good communication skills in English language.,.NET Developer,Software Developer,Web Developer
"Knowledge of relational databases design and systems, SQL programming skills; Strong Knowledge of PHP, XML, JavaScript, SQL, XSL, CSS, HTML; Expierence with WML (optional); Understanding of search engine optimisation and content managed web development; Working knowledge of cross-browser, usability and accessibility principles; Work experience with Linux OS; Time estimation and time management.",Database Admin/Dev,Web Developer,Java Developer
"At least 2 years of working experience with C#/ .NET; Bachelor's or higher degree in Computer Sciences, Physics, Mathematics or related disciplines; Good grades in undergraduate and other studies; Strong problem-solving skills and ability to be a successful member of a team; Strong knowledge of C#, Microsoft .Net Framework 4.0, Silverlight, ASP.NET MVC3, EF, WCF; Working experience with MVC and MVVM patterns; Working experience with programming user interfaces; Working experience with relational databases and SQL language; Ability to develop efficient codes; Familiarity with algorithms, ability to estimate algorithm complexity; Familiarity with data structures; Good English language skills including reading, writing, and speaking; Flexibility in learning and applying different programming languages and technologies. Desired qualifications: Familiarity with Java, C++, or other object oriented programming language; Familiarity with Javascript and related frameworks (JQuery, YUI, etc.); Ability to write programs using different programming languages and environments; Familiarity with different web development technologies (AJAX, HTML, CSS, etc.); Familiarity with architectural and design patterns.",Software Developer,Software Engineer,Web Developer
"At least 5 years of work experience as Software Developer; Excellent knowledge in Java and OOP; Excellent knowledge in Web development; Web Frameworks: Struts, JSP/Servlet, Java Server Faces; Persistence Layer: OJB, IBATIS, Hibernate; Integration Technologies: Spring Framework; Databases: Base knowledge with MySQL and Oracle databases; Excellent knowledge in SQL language (writing queries, creating databases, dumping, importing without a graphical user interface); Database Modeling skills; Good knowledge in (X)HTML, CSS, JavaScript, XML; Optional technologies: Velocity, Jasper Reports, Facelets; Build Environment: Ant, Maven, Eclipse; Servers: Tomcat, Apache2 Webserver; OS: Linux Ubuntu; High skills with Linux Operating System: system administration, writing Shell scripts etc.; Ability to work on project with a development team; Ability to lead a small development team would be a plus; Problem solving skills; Good communication skills; Good English language skills.",Java Developer,Software Engineer,PHP Developer
"University degree in the appropriate field of studies; At least 3 years of work experience; Knowledge of ASP.NET and C#; Work experience with HTML, CSS and JavaScript; Database proficiency in MSSQL; Knowledge of DHTML: JavaScript, AJAX, CSS2, CSS3, HTML4 and HTML5; Knowledge of OOP (Object-oriented programming) principles; Knowledge of other programming languages, such as Java is an advantage; Ability to work on multiple tasks and prioritize personal workload; Ability to work in a team.",Web Developer,Java Developer,PHP Developer
"BS in Computer Science or any related technical field;  At least 2 years of work experience as a Software Developer;  Good knowledge of OOP;  Good knowledge of C#, ASP.NET MVC, ADO.Net and web services; Knowledge of (X) HTML, CSS, JavaScript and XML;  Knowledge of WCF,WPF is a big advantage;  Knowledge of MS SQL server, developing queries and stored procedures; Fluency in Armenian language; good knowledge of Russian and English languages;  Problem-solving skills;  Familiarity with software development process.",Software Developer,.NET Developer,Web Developer
"University degree in a relevant field;  Strong knowledge of programming techniques and software development process;  Hands on experience in PHP and Java backend development; Hands on experience in HTML, JavaScript and CSS frontend development;  Strong knowledge of MySQL;  Ability to work under pressure in a fast changing environment;  Ability to work in close communication with team members.",Software Developer,Web Developer,PHP Developer
"Bachelor's degree in Computer Sciences or a related field; higher degree is a plus; At least 2 years of work experience with the following technologies: HTML/ CSS, JavaScript, AJAX, PHP, cakePHP or other frameworks; Experience in object oriented programming/ modular programming;  Understanding of MVC design patterns and frameworks; Knowledge of SQL/ MySQL and database design/ modeling; Understanding of browser specific compatibility issues; Knowledge of Apache server configuration/ administration is a plus; Knowledge of Linux command line is a plus; Ability to work both as an individual and as a part of a team;  Good written and verbal skills in English language; Ability to learn quickly.",Web Developer,PHP Developer,Java Developer
Good knowledge of PL/SQL programming language; Very good English speaking and writing skills.,Database Admin/Dev,Software Engineer,Software Developer
"University degree in the appropriate field of studies; At least 2 years of work experience in the appropriate field; Ability to create professional web pages using HTML/ HTML5, CSS/ CSS3 technologies; Ability to work with big data, develop modules which will meet high performance thresholds; Knowledge of jQuery; Cross Browser experience; Good knowledge of JavaScript; Interest in design; ability to modify things (or add things) to a given design; Detail-oriented personality; Problem-solving and analytical skills with the ability to clearly communicate and share solutions with fellow team members; Ability to respect deadlines; Good knowledge of English language.",Web Developer,Software Developer,PHP Developer
"Bachelor's degree in Computer Sciences or a related field; Over 3 years of web applications development;  Experience in designing and delivering complex web applications using PHP; Experience in XML, XLS, HTML, DHTML, CSS and JavaScript; Experience in PHP and MySQL; Strong understanding of OO programming concept; Experience in administering Linux, Apache, MySQL is a plus; Knowledge of AJAX is a plus; Knowledge of Typo3, Drupal and other open source CMSs is a plus; Good knowledge of English language is desired; writing English skills are obligatory.",Software Engineer,PHP Developer,Web Developer
"Knowledge of and experience in developing, theming, customizing and upgrading WordPress and other open source applications such as Joomla, Drupal; Work experience in a relevant field; Excellent knowledge of the English language; Knowledge of and experience in PHP interfacing with a relational database of MySQL; Knowledge of and experience with MVC frameworks is desirable; Ability to quickly troubleshoot and repair issues on websites; Experience with web development technologies/ production tools such as JavaScript Libraries and jQuery; Understanding of cross platform/ browser compatibility issues; Excellent communication and organizational skills; Experience with multiple breakpoint and responsive design techniques.",Web Developer,PHP Developer,Software Engineer
"Drawing skills; At least 3 years of experience in graphic design; Advanced level of knowledge in computer design software; Working level of Armenian, Russian and English languages; Strong interest in graphics and illustration; visual sense and originality; Attention to details; Excellent team-working skills.",Graphic Designer,Software Engineer,Software Developer
"Expert knowledge of PHP, Database (MySQL), HTML, DHTML, Java Script Some knowledge of Macromedia Flash including Active Script Hands-on experience with web-design tools such as Dreamweaver, Home Site Experience with Photoshop, ImageReady is an advantage Must be self-directed and have a track record of meeting project deadlines  At least 2 years experience in web programming",Web Developer,Java Developer,PHP Developer
"Higher education; Minimum 2 year work experience; Excellent communication and interpersonal skills; Flexibility and effective decision making in fast paced environment;  Knowledge of MS Word, Excel and Access; Ability to work with DBF files, MS SQL Server, ASP programming, Windows 2000-2003 Server; Willingness to study; Knowledge of Armenian and Russian languages; Knowledge of technical English.",Programmer,Software Developer,Web Developer
"At least 3 years of work experience as a Software Developer; At least 2 years of work experience with databases (Oracle/ MS SQL Server); Good knowledge of OOP; Good knowledge of C++ and SQL languages; Basic knowledge of web technologies; Problem solving skills; Knowledge of Armenian and Russian languages. Desired Qualifications: Knowledge of PL/SQL language;  Knowledge of banking system or accounting;  Knowledge of PHP, JSP and web services;  Knowledge of (X)HTML, CSS, JavaScript and XML; Knowledge of English language.",Database Admin/Dev,Software Developer,Web Developer
"BS in Computer Science or any related technical field; At least 4 years of work experience as a Senior .NET Developer; Good knowledge of OOP; Strong C#, ASP.NET background; Experience with ORMs (NHibernate/ Entity Framework 4); Experience with Web Services and WCF; Broad knowledge of ASP.NET architecture and development, as well as strong knowledge of using SOAP and REST; Good knowledge of HTML, JavaScript, AJAX, XML and JQuery;  Knowledge of MS SQL server, developing queries and stored procedures; Ability to work independently and in a team setting; Familiarity with software development process; Good knowledge of Russian and English languages is an asset; Desire and ability to work with a wide range of web application technologies and tools.",.NET Developer,Web Developer,Software Developer
"At least 2 years of web application development experience in .NET platform; Experience in WPF, WCF technologies and principals; Experience in ASP.NET; Experience in Web services; Excellent knowledge of (X)HTML, CSS, JavaScript (AJAX, jQuery) is a plus; Work experience with Microsoft SQL server 2008/ 2012; Problem solving skills; Good communication skills; Good team player, ability to accept criticism.",.NET Developer,Web Developer,PHP Developer
"BS/MS in CS/EE; 5+ years of experience in software development; Good communication skills; Self-motivation; Experience in designing and developing software products; Ability to lead the project development; previous experience of working on critical projects; Formal training or test certification is a plus; Strong C++/ STL programming skills, experience in widely accepted methodologies such as OOP, OOD, etc.; User knowledge of Linux, MS Windows is desirable; Strong knowledge of data structures and algorithms, their complexities; Mathematical background with an understanding of Computational Geometry, Graph Theory, Optimization Problems; Design/implementation specification writing skills; Knowledge and experience in Physical Design Automation, or related domains is preferred; Experience in designing EDA databases, solving tasks related to fast data access, storing and processing; Experience in working with cross-functional product development teams is preferred; Knowledge of technical English (both verbal and written); It is preferred that the candidates for the Senior Software Engineer position fulfilled military obligation or educational waivers of military obligation.",Software Engineer,Software Developer,Java Developer
"At least 3 years of Java programming experience; Extensive knowledge of Web Front End technologies: Apache Wicket, Struts 2, JSF; Extensive knowledge of MySQL, Hibernate; Experience with backend development/ individual application development; Experience with MQ, JMS; Experience with JasperReports and POI library; Good knowledge of English language; Ability to manage time, work load, project progress without supervision.",Java Developer,Software Developer,Web Developer
"BS in CS/EE with at least 2 years of experience in software development; Familiar with programming and software development cycle; Ability to design algorithms and data structures; Knowledge of C/C++ together with STL library; Knowledge of Linux and scripting languages (PERL, TCL) is a plus; Good English language skills in writing, reading, listening comprehension and oral communication.",Software Engineer,Software Developer,Web Developer
"University degree in the appropriate field of studies; At least 1 year of practical experience; Good knowledge of PHP; Good knowledge of OOP principles; Good knowledge of DHTML; Experience working in Linux environment (Ubuntu, Suse) is preferable; Good analytical skills; Ability to work in a team; Good knowledge of English language (both communication and technical level).",PHP Developer,Web Developer,Software Developer
"BS in Computer Science or any related Technical field; At least 6 years of experience in object-oriented design and development in Java; At least 6 years of experience in JEE Application Server; WebSphere and/ or JBOSS experience is preferred; At least 6 years of experience in JEE technologies and framework (Spring, JSF2 preferable) Hibernate, Websphere Application; Server (WAS), JMS/ Websphere MQ, Oracle AQ, Oracle 11g and support integration with other applications via APIs(SOAP/ REST); Experience in SOA, SOAP, REST WSDL, XML, cloud and API standards; At least 6 years of experience in design and development of high performance messaging and transaction processing systems; Strong knowledge of architectural principles, frameworks and best practices; Technical leadership and mentoring skills to guide and act as Lead Developer; Good knowledge or Russian and English languages is an asset.",Java Developer,Software Engineer,Software Developer
"Higher education; Excellent knowledge of VB;  Good knowledge of Java Script;  Experience of management of My SQL and MS SQL databases; Good knowledge of AS3x, AS4x; COM technologies; WEB technologies; NET technologies; Good knowledge of MS Windows XP/2003SF platform; Ability to responsibly complete assigned tasks according to deadlines; Analytical thinking; Sense of responsibility and accuracy; Flexible and teamwork ability;  Fluency in Armenian and Russian languages; knowledge of technical and spoken English; At least two years of relevant work experience. Ethics: Unquestioned principles and behavior. Collaborative and responsible work habits.",Senior Web Developer,Software Developer,Java Developer
"BS in CS/ EE with at least 1 years of work experience in software development; Familiarity with programming and software development cycle; Ability to design algorithms and data structures; Excellent knowledge of C/ C++ together with STL library; Good knowledge of Qt; TCL knowledge is a plus; Excellent knowledge of Linux; Good English language skills in writing, reading, listening; Comprehension and oral communication.",Software Engineer,Software Developer,Senior Web Developer
"MS in CS/ Physics/ Maths or a related field; Professional C/ C++ programming skills and good knowledge of OOP/ OOD; High-level of knowledge and experience in multithreading programming;  Strong debugging and troubleshooting experience; Clear understanding of software development lifecycles and methodologies; Good knowledge of and experience in HTML/ XML; Experience in Stingray Studio is plus; Experience in development under Linux/ Unix OS and Qt is plus; Experience in real time development, knowledge of networking protocols such as TCP/ IP, UDP, etc. is plus; Good written and verbal communication skills in English language.",Software Engineer,Software Developer,Web Developer
"Higher education in the associated field is preferable; At least 3 years of work experience as a Graphic Designer; Knowledge of Adobe Photoshop, Adobe Illustrator and Corel Draw; Knowledge of Armenian, English and Russian languages; Ability to work in a team.",Graphic Designer,Web Developer,Software Developer
"B.S in software engineering Minimum 2 years programming experience  Windows and Unix operating systems MS SQL Server, Oracle databases Visual Studio.Net ( Visual C++ and Visual Basic ) Knowledge of English language Preferred Qualification:          POS programming experience Smart cards programming experience  Knowledge of EMV",Programmer,Software Developer,Software Engineer
